<?xml version="1.0"?>
<!DOCTYPE Report
[
<!ELEMENT Report (General ,(Doc|BPT)) >
<!ATTLIST Report ver CDATA #REQUIRED tmZone CDATA #REQUIRED>

<!ELEMENT General ( DocLocation ) >
<!ATTLIST General productName CDATA #REQUIRED productVer CDATA #REQUIRED os CDATA #REQUIRED host CDATA #REQUIRED qcserver CDATA #IMPLIED qcproject CDATA #IMPLIED SolManSolutionId CDATA #IMPLIED SolManProjectId CDATA #IMPLIED SolManTestPlanId CDATA #IMPLIED SolManTestPackageId CDATA #IMPLIED SolManUserInfoData CDATA #IMPLIED  >

<!ELEMENT BPT (DName,Res,DVer?,TSet?,TInst?,NodeArgs,AdditionalInfo*,Doc*) >
<!ATTLIST BPT rID ID #REQUIRED >

<!ELEMENT Doc (DName,ConfName?,Res,DVer?,TSet?,TInst?,RunType?,DT?,AdditionalInfo*,Step*,DIter*,Step*,Action*,Doc*,Summary?,TestMaintenanceSummary*,NodeArgs?) >
<!ATTLIST Doc rID ID #REQUIRED type (Test|BC|BPTWrapperTest|Flow|Group|Action) "Test" productName CDATA #REQUIRED BCIter CDATA #IMPLIED >

<!ELEMENT RunType ( #PCDATA )>
<!ATTLIST RunType fmStep (False|True) "False" batch (False|True) "False" upDesc (False|True) "False" upChk (False|True) "False" upAS (False|True) "False">

<!ELEMENT DName ( #PCDATA ) >

<!ELEMENT ConfName ( #PCDATA ) >

<!ELEMENT Res ( #PCDATA ) >

<!ELEMENT AdditionalInfo (AdditionalDataName,AdditionalDataValue ) >

<!ELEMENT AdditionalDataName ( #PCDATA ) >

<!ELEMENT AdditionalDataValue ( #PCDATA ) >

<!ELEMENT DVer ( #PCDATA ) >

<!ELEMENT TSet ( #PCDATA ) >

<!ELEMENT TInst ( #PCDATA ) >

<!ELEMENT DIter (Step*,Action+,Summary?,NodeArgs)>
<!ATTLIST DIter rID ID #REQUIRED iterID CDATA #REQUIRED>

<!ELEMENT DocLocation ( #PCDATA )>

<!ELEMENT Action (AName,AIter*,(Step|HtmlStep|Action)*, Summary,ActionMaintenanceSummary*, NodeArgs ) >
<!ATTLIST Action rID ID #REQUIRED>

<!ELEMENT AIter ((Step|HtmlStep|Action)*,DataMapping?, Summary?,NodeArgs) >
<!ATTLIST AIter rID ID #REQUIRED iterID CDATA #REQUIRED isCountable (False|True) "False" >

<!ELEMENT AName ( #PCDATA ) >

<!ELEMENT TestMaintenanceSummary (ActionMaintenanceSummary*) >
<!ATTLIST TestMaintenanceSummary ObjectsAdded CDATA #REQUIRED ObjectsUpdated CDATA #REQUIRED StepsUpdated CDATA #REQUIRED StepsComments CDATA #REQUIRED><!ELEMENT ActionMaintenanceSummary (ObjectChange* ) >
<!ATTLIST ActionMaintenanceSummary Action CDATA #REQUIRED Objects CDATA #REQUIRED Updated CDATA #REQUIRED LinesTotal CDATA #REQUIRED Added CDATA #REQUIRED LinesUpdated CDATA #REQUIRED>

<!ELEMENT ObjectChange  (Hierarchy, PropertyChangeList* ) >
<!ATTLIST ObjectChange Operation CDATA #IMPLIED OriginalRepository CDATA #IMPLIED>

<!ELEMENT PropertyChangeList (PropertyDef*) >

<!ELEMENT PropertyDef (OriginalValue, NewValue) >
<!ATTLIST PropertyDef PropName CDATA #REQUIRED OriginRegularExpression (True|False) "False" NewRegularExpression (True|False) "False" AddedProperty (True|False) "False" >

<!ELEMENT OriginalValue ( #PCDATA )>

<!ELEMENT NewValue ( #PCDATA )>

<!ELEMENT Hierarchy  (ObjectName, Hierarchy*) >
<!ATTLIST Hierarchy MicClass CDATA #REQUIRED>

<!ELEMENT ObjectName  ( #PCDATA ) >

<!ELEMENT Step (Obj,Details,Time,TimeTick* ,(Step|HtmlStep|Doc)*, DataMapping?, NodeArgs) >
<!ATTLIST Step rID ID #REQUIRED retval CDATA #IMPLIED>

<!ELEMENT HtmlStep (HTML,TimeTick*,(Step|HtmlStep|Doc)*,NodeArgs) >
<!ATTLIST HtmlStep rID ID #REQUIRED >

<!ELEMENT Obj ( #PCDATA ) >
<!ATTLIST Obj plainTxt (False|True) "True">

<!ELEMENT Details ( #PCDATA ) >
<!ATTLIST Details plainTxt (False|True) "True">

<!ELEMENT Time ( #PCDATA ) >

<!ELEMENT HTML ( #PCDATA ) >

<!ELEMENT Disp ( #PCDATA ) >

<!ELEMENT TimeTick ( #PCDATA ) >

<!ELEMENT DataMapping ( DataMappedItem* )>
<!ELEMENT DataMappedItem EMPTY >
<!ATTLIST DataMappedItem dsName CDATA #REQUIRED >
<!ATTLIST DataMappedItem rowId CDATA #REQUIRED >

<!ELEMENT NodeArgs (Disp,TopPane?,BtmPane?,ExtendedInfo? )>
<!ATTLIST NodeArgs eType CDATA #REQUIRED icon CDATA #REQUIRED nRep CDATA #REQUIRED UserNote CDATA #IMPLIED filter (False|True) "True">
<!ATTLIST NodeArgs status (Passed|Failed|Done|Warning|Information) "Done">
<!ATTLIST NodeArgs iconSel CDATA #IMPLIED nType CDATA #IMPLIED MovieMarker CDATA "">
<!ATTLIST NodeArgs Source CDATA #IMPLIED SourceLine CDATA #IMPLIED StepFlowItemKey CDATA #IMPLIED >

<!ELEMENT TopPane (Path)>

<!ELEMENT BtmPane ( (Path|WR)?,ASHilite?)>
<!ATTLIST BtmPane vType CDATA "HTML">

<!ELEMENT Path ( #PCDATA ) >

<!ELEMENT ASHilite ( #PCDATA ) >

<!ELEMENT WR ( #PCDATA ) >

<!ELEMENT ExtendedInfo ( StepData ) >

<!ATTLIST ExtendedInfo StepType CDATA #REQUIRED>
<!ELEMENT DT (NodeArgs) >
<!ATTLIST DT rID ID #REQUIRED>

<!ELEMENT Summary (Param*)>
<!ATTLIST Summary sTime CDATA #IMPLIED eTime CDATA #IMPLIED passed CDATA #IMPLIED failed CDATA #IMPLIED warnings CDATA #IMPLIED retval CDATA #IMPLIED stopped (False|True) "False" >

<!ELEMENT Param (ParamName,ParamVal)+ >
<!ATTLIST Param paramInOut (In|Out) "In">

<!ELEMENT ParamName ( #PCDATA ) >

<!ELEMENT ParamVal ( #PCDATA ) >

]
>
<Report ver="2.0" tmZone="W. Europe Standard Time">
<General productName="HP Unified Functional Testing" productVer="12.02" os="Windows 7" host="ITINBAI-DW0014"><DocLocation><![CDATA[\\Itseelm-nt0034\ampes1$\Desktop\RegressionPack0.4\Driver]]></DocLocation></General>
<Doc rID="T1"   productName= "HP Unified Functional Testing"  >
<DName><![CDATA[Driver]]></DName>
<Res><![CDATA[Res47]]></Res>
<DT rID="T2">
<NodeArgs eType="Table" icon="2" nRep="4" filter="False" >
<Disp><![CDATA[Run-Time Data Table]]></Disp>
<BtmPane vType="Table" >
<Path><![CDATA[Default_0.xls]]></Path>
</BtmPane>
</NodeArgs>
</DT>
<Step rID="T3">
<Obj ><![CDATA[Excel Sheet Import]]></Obj>
<Details ><![CDATA[Excel Sheet  Applications Import to Applications operation Done Succefully]]></Details>
<Time><![CDATA[6/28/2016 - 16:50:24]]></Time>
<TimeTick>1467125424</TimeTick>
<NodeArgs eType="User" icon="3" nRep="6" status="Passed" >
<Disp><![CDATA[Excel Sheet Import]]></Disp>
</NodeArgs>
</Step>
<Action rID="T4">
<AName><![CDATA[Driver]]></AName>
<Step rID="T5">
<Obj plainTxt="False" ><![CDATA[[ Browser ].Exist]]></Obj>
<Details plainTxt="False" ><![CDATA["Object does not exist"]]></Details>
<Time><![CDATA[6/28/2016 - 16:50:27]]></Time>
<TimeTick>1467125427</TimeTick>
<NodeArgs eType="Replay" icon="5" nRep="9" >
<Disp><![CDATA[[ Browser ].Exist]]></Disp>
</NodeArgs>
</Step>
<Step rID="T6">
<Obj ><![CDATA[Excel Sheet Import]]></Obj>
<Details ><![CDATA[Excel Sheet  Global Import to Global operation Done Succefully]]></Details>
<Time><![CDATA[6/28/2016 - 16:50:27]]></Time>
<TimeTick>1467125427</TimeTick>
<NodeArgs eType="User" icon="3" nRep="10" status="Passed" >
<Disp><![CDATA[Excel Sheet Import]]></Disp>
</NodeArgs>
</Step>
<Step rID="T7">
<Obj ><![CDATA[Excel Sheet Import]]></Obj>
<Details ><![CDATA[Excel Sheet  GlobalWorkflow Import to GlobalWorkflow operation Done Succefully]]></Details>
<Time><![CDATA[6/28/2016 - 16:51:09]]></Time>
<TimeTick>1467125469</TimeTick>
<NodeArgs eType="User" icon="3" nRep="11" status="Passed" Source="\\Itseelm-nt0034\ampes1$\Desktop\RegressionPack0.4\TestCases\TestCases.txt" SourceLine="-1" >
<Disp><![CDATA[Excel Sheet Import]]></Disp>
</NodeArgs>
</Step>
<Step rID="T8">
<Obj plainTxt="False" ><![CDATA[OWCS]]></Obj>
<Details plainTxt="False" ><![CDATA[Browser]]></Details>
<Time><![CDATA[6/28/2016 - 16:51:14]]></Time>
<TimeTick>1467125474</TimeTick>
<Step rID="T9">
<Obj plainTxt="False" ><![CDATA[OWCS.Exist]]></Obj>
<Details plainTxt="False" ><![CDATA["Object does not exist"]]></Details>
<Time><![CDATA[6/28/2016 - 16:51:14]]></Time>
<TimeTick>1467125474</TimeTick>
<NodeArgs eType="Replay" icon="5" nRep="14" Source="\\Itseelm-nt0034\ampes1$\Desktop\RegressionPack0.4\Resources\FunctionLibrary\ActionNavigation.txt" SourceLine="-1" >
<Disp><![CDATA[OWCS.Exist]]></Disp>
</NodeArgs>
</Step>
<Step rID="T10">
<Obj plainTxt="False" ><![CDATA[SystemUtil]]></Obj>
<Details plainTxt="False" ><![CDATA[SystemUtil]]></Details>
<Time><![CDATA[6/28/2016 - 16:51:15]]></Time>
<TimeTick>1467125475</TimeTick>
<Step rID="T11">
<Obj plainTxt="False" ><![CDATA[Run "firefox.exe",1]]></Obj>
<Details plainTxt="False" ><![CDATA[Run "firefox.exe",1]]></Details>
<Time><![CDATA[6/28/2016 - 16:51:15]]></Time>
<TimeTick>1467125475</TimeTick>
<NodeArgs eType="Replay" icon="6" nRep="18" status="Passed" Source="\\Itseelm-nt0034\ampes1$\Desktop\RegressionPack0.4\Resources\FunctionLibrary\ActionNavigation.txt" SourceLine="-1" >
<Disp><![CDATA[Run "firefox.exe",1]]></Disp>
</NodeArgs>
</Step>
<NodeArgs eType="Replay" icon="6" nRep="17" status="Passed" Source="\\Itseelm-nt0034\ampes1$\Desktop\RegressionPack0.4\Resources\FunctionLibrary\ActionNavigation.txt" SourceLine="-1" >
<Disp><![CDATA[SystemUtil]]></Disp>
</NodeArgs>
</Step>
<Step rID="T12">
<Obj plainTxt="False" ><![CDATA[OWCS.Exist]]></Obj>
<Details plainTxt="False" ><![CDATA["Object exists"]]></Details>
<Time><![CDATA[6/28/2016 - 16:51:25]]></Time>
<TimeTick>1467125485</TimeTick>
<NodeArgs eType="Replay" icon="5" nRep="19" Source="\\Itseelm-nt0034\ampes1$\Desktop\RegressionPack0.4\Resources\FunctionLibrary\ActionNavigation.txt" SourceLine="-1" >
<Disp><![CDATA[OWCS.Exist]]></Disp>
</NodeArgs>
</Step>
<Step rID="T13">
<Obj plainTxt="False" ><![CDATA[OWCS.Exist]]></Obj>
<Details plainTxt="False" ><![CDATA["Object exists"]]></Details>
<Time><![CDATA[6/28/2016 - 16:51:25]]></Time>
<TimeTick>1467125485</TimeTick>
<NodeArgs eType="Replay" icon="5" nRep="20" Source="\\Itseelm-nt0034\ampes1$\Desktop\RegressionPack0.4\Resources\FunctionLibrary\ActionNavigation.txt" SourceLine="-1" >
<Disp><![CDATA[OWCS.Exist]]></Disp>
</NodeArgs>
</Step>
<NodeArgs eType="Context" icon="5" nRep="13" status="Passed" Source="\\Itseelm-nt0034\ampes1$\Desktop\RegressionPack0.4\Resources\FunctionLibrary\ActionNavigation.txt" SourceLine="-1" >
<Disp><![CDATA[OWCS]]></Disp>
</NodeArgs>
</Step>
<Step rID="T14">
<Obj ><![CDATA[CheckBrowserExist]]></Obj>
<Details ><![CDATA[Browser exist]]></Details>
<Time><![CDATA[6/28/2016 - 16:51:25]]></Time>
<TimeTick>1467125485</TimeTick>
<NodeArgs eType="User" icon="3" nRep="21" Source="\\Itseelm-nt0034\ampes1$\Desktop\RegressionPack0.4\Resources\FunctionLibrary\ActionNavigation.txt" SourceLine="-1" >
<Disp><![CDATA[CheckBrowserExist]]></Disp>
</NodeArgs>
</Step>
<Step rID="T15">
<Obj plainTxt="False" ><![CDATA[OWCS]]></Obj>
<Details plainTxt="False" ><![CDATA[Browser]]></Details>
<Time><![CDATA[6/28/2016 - 16:51:26]]></Time>
<TimeTick>1467125486</TimeTick>
<Step rID="T16">
<Obj plainTxt="False" ><![CDATA[OWCS]]></Obj>
<Details plainTxt="False" ><![CDATA[Page]]></Details>
<Time><![CDATA[6/28/2016 - 16:51:26]]></Time>
<TimeTick>1467125486</TimeTick>
<Step rID="T17">
<Obj plainTxt="False" ><![CDATA[txtUsername.Exist]]></Obj>
<Details plainTxt="False" ><![CDATA["Object exists"]]></Details>
<Time><![CDATA[6/28/2016 - 16:51:26]]></Time>
<TimeTick>1467125486</TimeTick>
<NodeArgs eType="Replay" icon="8" nRep="25" Source="\\Itseelm-nt0034\ampes1$\Desktop\RegressionPack0.4\Resources\FunctionLibrary\ActionNavigation.txt" SourceLine="-1" >
<Disp><![CDATA[txtUsername.Exist]]></Disp>
</NodeArgs>
</Step>
<Step rID="T18">
<Obj plainTxt="False" ><![CDATA[txtUsername.Click]]></Obj>
<Details plainTxt="False" ><![CDATA[]]></Details>
<Time><![CDATA[6/28/2016 - 16:51:26]]></Time>
<TimeTick>1467125486</TimeTick>
<NodeArgs eType="Replay" icon="8" nRep="27" Source="\\Itseelm-nt0034\ampes1$\Desktop\RegressionPack0.4\Resources\FunctionLibrary\ActionNavigation.txt" SourceLine="-1" >
<Disp><![CDATA[txtUsername.Click]]></Disp>
</NodeArgs>
</Step>
<Step rID="T19">
<Obj plainTxt="False" ><![CDATA[txtUsername.Set]]></Obj>
<Details plainTxt="False" ><![CDATA["fwadmin"]]></Details>
<Time><![CDATA[6/28/2016 - 16:51:26]]></Time>
<TimeTick>1467125486</TimeTick>
<NodeArgs eType="Replay" icon="8" nRep="29" Source="\\Itseelm-nt0034\ampes1$\Desktop\RegressionPack0.4\Resources\FunctionLibrary\ActionNavigation.txt" SourceLine="-1" >
<Disp><![CDATA[txtUsername.Set]]></Disp>
</NodeArgs>
</Step>
<NodeArgs eType="Context" icon="7" nRep="24" Source="\\Itseelm-nt0034\ampes1$\Desktop\RegressionPack0.4\Resources\FunctionLibrary\ActionNavigation.txt" SourceLine="-1" >
<Disp><![CDATA[OWCS]]></Disp>
</NodeArgs>
</Step>
<NodeArgs eType="Context" icon="5" nRep="23" Source="\\Itseelm-nt0034\ampes1$\Desktop\RegressionPack0.4\Resources\FunctionLibrary\ActionNavigation.txt" SourceLine="-1" >
<Disp><![CDATA[OWCS]]></Disp>
</NodeArgs>
</Step>
<Step rID="T20">
<Obj ><![CDATA[TakeAction]]></Obj>
<Details ><![CDATA[WebEdit  - Username
Entered - fwadmin]]></Details>
<Time><![CDATA[6/28/2016 - 16:51:26]]></Time>
<TimeTick>1467125486</TimeTick>
<NodeArgs eType="User" icon="3" nRep="30" Source="\\Itseelm-nt0034\ampes1$\Desktop\RegressionPack0.4\Resources\FunctionLibrary\ActionNavigation.txt" SourceLine="-1" >
<Disp><![CDATA[TakeAction]]></Disp>
</NodeArgs>
</Step>
<Step rID="T21">
<Obj plainTxt="False" ><![CDATA[OWCS]]></Obj>
<Details plainTxt="False" ><![CDATA[Browser]]></Details>
<Time><![CDATA[6/28/2016 - 16:51:27]]></Time>
<TimeTick>1467125487</TimeTick>
<Step rID="T22">
<Obj plainTxt="False" ><![CDATA[OWCS]]></Obj>
<Details plainTxt="False" ><![CDATA[Page]]></Details>
<Time><![CDATA[6/28/2016 - 16:51:27]]></Time>
<TimeTick>1467125487</TimeTick>
<Step rID="T23">
<Obj plainTxt="False" ><![CDATA[txtPassword.Exist]]></Obj>
<Details plainTxt="False" ><![CDATA["Object exists"]]></Details>
<Time><![CDATA[6/28/2016 - 16:51:27]]></Time>
<TimeTick>1467125487</TimeTick>
<NodeArgs eType="Replay" icon="8" nRep="34" Source="\\Itseelm-nt0034\ampes1$\Desktop\RegressionPack0.4\Resources\FunctionLibrary\ActionNavigation.txt" SourceLine="-1" >
<Disp><![CDATA[txtPassword.Exist]]></Disp>
</NodeArgs>
</Step>
<Step rID="T24">
<Obj plainTxt="False" ><![CDATA[txtPassword.Click]]></Obj>
<Details plainTxt="False" ><![CDATA[]]></Details>
<Time><![CDATA[6/28/2016 - 16:51:27]]></Time>
<TimeTick>1467125487</TimeTick>
<NodeArgs eType="Replay" icon="8" nRep="36" Source="\\Itseelm-nt0034\ampes1$\Desktop\RegressionPack0.4\Resources\FunctionLibrary\ActionNavigation.txt" SourceLine="-1" >
<Disp><![CDATA[txtPassword.Click]]></Disp>
</NodeArgs>
</Step>
<Step rID="T25">
<Obj plainTxt="False" ><![CDATA[txtPassword.SetSecure]]></Obj>
<Details plainTxt="False" ><![CDATA["xceladmin"]]></Details>
<Time><![CDATA[6/28/2016 - 16:51:27]]></Time>
<TimeTick>1467125487</TimeTick>
<NodeArgs eType="Replay" icon="8" nRep="38" Source="\\Itseelm-nt0034\ampes1$\Desktop\RegressionPack0.4\Resources\FunctionLibrary\ActionNavigation.txt" SourceLine="-1" >
<Disp><![CDATA[txtPassword.SetSecure]]></Disp>
</NodeArgs>
</Step>
<NodeArgs eType="Context" icon="7" nRep="33" Source="\\Itseelm-nt0034\ampes1$\Desktop\RegressionPack0.4\Resources\FunctionLibrary\ActionNavigation.txt" SourceLine="-1" >
<Disp><![CDATA[OWCS]]></Disp>
</NodeArgs>
</Step>
<NodeArgs eType="Context" icon="5" nRep="32" Source="\\Itseelm-nt0034\ampes1$\Desktop\RegressionPack0.4\Resources\FunctionLibrary\ActionNavigation.txt" SourceLine="-1" >
<Disp><![CDATA[OWCS]]></Disp>
</NodeArgs>
</Step>
<Step rID="T26">
<Obj ><![CDATA[TakeAction]]></Obj>
<Details ><![CDATA[WebEdit  - Password
Entered - xceladmin]]></Details>
<Time><![CDATA[6/28/2016 - 16:51:27]]></Time>
<TimeTick>1467125487</TimeTick>
<NodeArgs eType="User" icon="3" nRep="39" Source="\\Itseelm-nt0034\ampes1$\Desktop\RegressionPack0.4\Resources\FunctionLibrary\ActionNavigation.txt" SourceLine="-1" >
<Disp><![CDATA[TakeAction]]></Disp>
</NodeArgs>
</Step>
<Step rID="T27">
<Obj plainTxt="False" ><![CDATA[OWCS]]></Obj>
<Details plainTxt="False" ><![CDATA[Browser]]></Details>
<Time><![CDATA[6/28/2016 - 16:51:28]]></Time>
<TimeTick>1467125488</TimeTick>
<Step rID="T28">
<Obj plainTxt="False" ><![CDATA[OWCS]]></Obj>
<Details plainTxt="False" ><![CDATA[Page]]></Details>
<Time><![CDATA[6/28/2016 - 16:51:28]]></Time>
<TimeTick>1467125488</TimeTick>
<Step rID="T29">
<Obj plainTxt="False" ><![CDATA[eleLogIn.Exist]]></Obj>
<Details plainTxt="False" ><![CDATA["Object exists"]]></Details>
<Time><![CDATA[6/28/2016 - 16:51:28]]></Time>
<TimeTick>1467125488</TimeTick>
<NodeArgs eType="Replay" icon="9" nRep="43" Source="\\Itseelm-nt0034\ampes1$\Desktop\RegressionPack0.4\Resources\FunctionLibrary\ActionNavigation.txt" SourceLine="-1" >
<Disp><![CDATA[eleLogIn.Exist]]></Disp>
</NodeArgs>
</Step>
<Step rID="T30">
<Obj plainTxt="False" ><![CDATA[eleLogIn.Click]]></Obj>
<Details plainTxt="False" ><![CDATA[]]></Details>
<Time><![CDATA[6/28/2016 - 16:51:28]]></Time>
<TimeTick>1467125488</TimeTick>
<NodeArgs eType="Replay" icon="9" nRep="45" Source="\\Itseelm-nt0034\ampes1$\Desktop\RegressionPack0.4\Resources\FunctionLibrary\ActionNavigation.txt" SourceLine="-1" >
<Disp><![CDATA[eleLogIn.Click]]></Disp>
</NodeArgs>
</Step>
<NodeArgs eType="Context" icon="7" nRep="42" Source="\\Itseelm-nt0034\ampes1$\Desktop\RegressionPack0.4\Resources\FunctionLibrary\ActionNavigation.txt" SourceLine="-1" >
<Disp><![CDATA[OWCS]]></Disp>
</NodeArgs>
</Step>
<NodeArgs eType="Context" icon="5" nRep="41" Source="\\Itseelm-nt0034\ampes1$\Desktop\RegressionPack0.4\Resources\FunctionLibrary\ActionNavigation.txt" SourceLine="-1" >
<Disp><![CDATA[OWCS]]></Disp>
</NodeArgs>
</Step>
<Step rID="T31">
<Obj ><![CDATA[TakeAction]]></Obj>
<Details ><![CDATA[WebElement   - LogIn
clicked - ]]></Details>
<Time><![CDATA[6/28/2016 - 16:51:28]]></Time>
<TimeTick>1467125488</TimeTick>
<NodeArgs eType="User" icon="3" nRep="46" Source="\\Itseelm-nt0034\ampes1$\Desktop\RegressionPack0.4\Resources\FunctionLibrary\ActionNavigation.txt" SourceLine="-1" >
<Disp><![CDATA[TakeAction]]></Disp>
</NodeArgs>
</Step>
<Step rID="T32">
<Obj plainTxt="False" ><![CDATA[OWCS]]></Obj>
<Details plainTxt="False" ><![CDATA[Browser]]></Details>
<Time><![CDATA[6/28/2016 - 16:51:38]]></Time>
<TimeTick>1467125498</TimeTick>
<Step rID="T33">
<Obj plainTxt="False" ><![CDATA[OWCS]]></Obj>
<Details plainTxt="False" ><![CDATA[Page]]></Details>
<Time><![CDATA[6/28/2016 - 16:51:38]]></Time>
<TimeTick>1467125498</TimeTick>
<Step rID="T34">
<Obj plainTxt="False" ><![CDATA[eleSiteIcon.Exist]]></Obj>
<Details plainTxt="False" ><![CDATA["Object exists"]]></Details>
<Time><![CDATA[6/28/2016 - 16:51:38]]></Time>
<TimeTick>1467125498</TimeTick>
<NodeArgs eType="Replay" icon="9" nRep="50" Source="\\Itseelm-nt0034\ampes1$\Desktop\RegressionPack0.4\Resources\FunctionLibrary\ActionNavigation.txt" SourceLine="-1" >
<Disp><![CDATA[eleSiteIcon.Exist]]></Disp>
</NodeArgs>
</Step>
<Step rID="T35">
<Obj plainTxt="False" ><![CDATA[eleSiteIcon.Click]]></Obj>
<Details plainTxt="False" ><![CDATA[]]></Details>
<Time><![CDATA[6/28/2016 - 16:51:38]]></Time>
<TimeTick>1467125498</TimeTick>
<NodeArgs eType="Replay" icon="9" nRep="52" Source="\\Itseelm-nt0034\ampes1$\Desktop\RegressionPack0.4\Resources\FunctionLibrary\ActionNavigation.txt" SourceLine="-1" >
<Disp><![CDATA[eleSiteIcon.Click]]></Disp>
</NodeArgs>
</Step>
<Step rID="T36">
<Obj plainTxt="False" ><![CDATA[eleIkeaGlobal.Exist]]></Obj>
<Details plainTxt="False" ><![CDATA["Object exists"]]></Details>
<Time><![CDATA[6/28/2016 - 16:51:40]]></Time>
<TimeTick>1467125500</TimeTick>
<NodeArgs eType="Replay" icon="9" nRep="53" Source="\\Itseelm-nt0034\ampes1$\Desktop\RegressionPack0.4\Resources\FunctionLibrary\ActionNavigation.txt" SourceLine="-1" >
<Disp><![CDATA[eleIkeaGlobal.Exist]]></Disp>
</NodeArgs>
</Step>
<NodeArgs eType="Context" icon="7" nRep="49" Source="\\Itseelm-nt0034\ampes1$\Desktop\RegressionPack0.4\Resources\FunctionLibrary\ActionNavigation.txt" SourceLine="-1" >
<Disp><![CDATA[OWCS]]></Disp>
</NodeArgs>
</Step>
<NodeArgs eType="Context" icon="5" nRep="48" Source="\\Itseelm-nt0034\ampes1$\Desktop\RegressionPack0.4\Resources\FunctionLibrary\ActionNavigation.txt" SourceLine="-1" >
<Disp><![CDATA[OWCS]]></Disp>
</NodeArgs>
</Step>
<Step rID="T37">
<Obj ><![CDATA[SelectSite]]></Obj>
<Details ><![CDATA[eleIkeaGlobal  selected.]]></Details>
<Time><![CDATA[6/28/2016 - 16:51:45]]></Time>
<TimeTick>1467125505</TimeTick>
<NodeArgs eType="User" icon="3" nRep="55" Source="\\Itseelm-nt0034\ampes1$\Desktop\RegressionPack0.4\Resources\FunctionLibrary\ActionNavigation.txt" SourceLine="-1" >
<Disp><![CDATA[SelectSite]]></Disp>
</NodeArgs>
</Step>
<Step rID="T38">
<Obj plainTxt="False" ><![CDATA[OWCS]]></Obj>
<Details plainTxt="False" ><![CDATA[Browser]]></Details>
<Time><![CDATA[6/28/2016 - 16:51:45]]></Time>
<TimeTick>1467125505</TimeTick>
<Step rID="T39">
<Obj plainTxt="False" ><![CDATA[OWCS]]></Obj>
<Details plainTxt="False" ><![CDATA[Page]]></Details>
<Time><![CDATA[6/28/2016 - 16:51:45]]></Time>
<TimeTick>1467125505</TimeTick>
<Step rID="T40">
<Obj plainTxt="False" ><![CDATA[imgAdmin.Exist]]></Obj>
<Details plainTxt="False" ><![CDATA["Object exists"]]></Details>
<Time><![CDATA[6/28/2016 - 16:51:45]]></Time>
<TimeTick>1467125505</TimeTick>
<NodeArgs eType="Replay" icon="10" nRep="58" Source="\\Itseelm-nt0034\ampes1$\Desktop\RegressionPack0.4\Resources\FunctionLibrary\ActionNavigation.txt" SourceLine="-1" >
<Disp><![CDATA[imgAdmin.Exist]]></Disp>
</NodeArgs>
</Step>
<Step rID="T41">
<Obj plainTxt="False" ><![CDATA[Frame]]></Obj>
<Details plainTxt="False" ><![CDATA[Frame]]></Details>
<Time><![CDATA[6/28/2016 - 16:52:09]]></Time>
<TimeTick>1467125529</TimeTick>
<Step rID="T42">
<Obj plainTxt="False" ><![CDATA[eleContent.Exist]]></Obj>
<Details plainTxt="False" ><![CDATA["Object does not exist"]]></Details>
<Time><![CDATA[6/28/2016 - 16:52:09]]></Time>
<TimeTick>1467125529</TimeTick>
<NodeArgs eType="Replay" icon="9" nRep="242" Source="\\Itseelm-nt0034\ampes1$\Desktop\RegressionPack0.4\Resources\FunctionLibrary\ActionNavigation.txt" SourceLine="-1" >
<Disp><![CDATA[eleContent.Exist]]></Disp>
</NodeArgs>
</Step>
<Step rID="T43">
<Obj plainTxt="False" ><![CDATA[eleAdminSite.Exist]]></Obj>
<Details plainTxt="False" ><![CDATA["Object does not exist"]]></Details>
<Time><![CDATA[6/28/2016 - 16:52:29]]></Time>
<TimeTick>1467125549</TimeTick>
<NodeArgs eType="Replay" icon="9" nRep="426" Source="\\Itseelm-nt0034\ampes1$\Desktop\RegressionPack0.4\Resources\FunctionLibrary\ActionNavigation.txt" SourceLine="-1" >
<Disp><![CDATA[eleAdminSite.Exist]]></Disp>
</NodeArgs>
</Step>
<NodeArgs eType="Context" icon="11" nRep="241" Source="\\Itseelm-nt0034\ampes1$\Desktop\RegressionPack0.4\Resources\FunctionLibrary\ActionNavigation.txt" SourceLine="-1" >
<Disp><![CDATA[Frame]]></Disp>
</NodeArgs>
</Step>
<Step rID="T44">
<Obj plainTxt="False" ><![CDATA[XcelBanner]]></Obj>
<Details plainTxt="False" ><![CDATA[Frame]]></Details>
<Time><![CDATA[6/28/2016 - 16:52:29]]></Time>
<TimeTick>1467125549</TimeTick>
<Step rID="T45">
<Obj plainTxt="False" ><![CDATA[eleNewTab.Exist]]></Obj>
<Details plainTxt="False" ><![CDATA["Object exists"]]></Details>
<Time><![CDATA[6/28/2016 - 16:52:29]]></Time>
<TimeTick>1467125549</TimeTick>
<NodeArgs eType="Replay" icon="9" nRep="428" Source="\\Itseelm-nt0034\ampes1$\Desktop\RegressionPack0.4\Resources\FunctionLibrary\ActionNavigation.txt" SourceLine="-1" >
<Disp><![CDATA[eleNewTab.Exist]]></Disp>
</NodeArgs>
</Step>
<NodeArgs eType="Context" icon="11" nRep="427" Source="\\Itseelm-nt0034\ampes1$\Desktop\RegressionPack0.4\Resources\FunctionLibrary\ActionNavigation.txt" SourceLine="-1" >
<Disp><![CDATA[XcelBanner]]></Disp>
</NodeArgs>
</Step>
<NodeArgs eType="Context" icon="7" nRep="57" Source="\\Itseelm-nt0034\ampes1$\Desktop\RegressionPack0.4\Resources\FunctionLibrary\ActionNavigation.txt" SourceLine="-1" >
<Disp><![CDATA[OWCS]]></Disp>
</NodeArgs>
</Step>
<NodeArgs eType="Context" icon="5" nRep="56" Source="\\Itseelm-nt0034\ampes1$\Desktop\RegressionPack0.4\Resources\FunctionLibrary\ActionNavigation.txt" SourceLine="-1" >
<Disp><![CDATA[OWCS]]></Disp>
</NodeArgs>
</Step>
<Step rID="T46">
<Obj ><![CDATA[SelectIcon]]></Obj>
<Details ><![CDATA[imgAdmin  selected.]]></Details>
<Time><![CDATA[6/28/2016 - 16:52:29]]></Time>
<TimeTick>1467125549</TimeTick>
<NodeArgs eType="User" icon="3" nRep="429" Source="\\Itseelm-nt0034\ampes1$\Desktop\RegressionPack0.4\Resources\FunctionLibrary\ActionNavigation.txt" SourceLine="-1" >
<Disp><![CDATA[SelectIcon]]></Disp>
</NodeArgs>
</Step>
<Step rID="T47">
<Obj plainTxt="False" ><![CDATA[OWCS]]></Obj>
<Details plainTxt="False" ><![CDATA[Browser]]></Details>
<Time><![CDATA[6/28/2016 - 16:52:31]]></Time>
<TimeTick>1467125551</TimeTick>
<Step rID="T48">
<Obj plainTxt="False" ><![CDATA[OWCS]]></Obj>
<Details plainTxt="False" ><![CDATA[Page]]></Details>
<Time><![CDATA[6/28/2016 - 16:52:31]]></Time>
<TimeTick>1467125551</TimeTick>
<Step rID="T49">
<Obj plainTxt="False" ><![CDATA[XcelBanner]]></Obj>
<Details plainTxt="False" ><![CDATA[Frame]]></Details>
<Time><![CDATA[6/28/2016 - 16:52:31]]></Time>
<TimeTick>1467125551</TimeTick>
<Step rID="T50">
<Obj plainTxt="False" ><![CDATA[eleWorkflow.Click]]></Obj>
<Details plainTxt="False" ><![CDATA[]]></Details>
<Time><![CDATA[6/28/2016 - 16:52:31]]></Time>
<TimeTick>1467125551</TimeTick>
<NodeArgs eType="Replay" icon="9" nRep="434" Source="\\Itseelm-nt0034\ampes1$\Desktop\RegressionPack0.4\Resources\FunctionLibrary\ActionNavigation.txt" SourceLine="-1" >
<Disp><![CDATA[eleWorkflow.Click]]></Disp>
</NodeArgs>
</Step>
<NodeArgs eType="Context" icon="11" nRep="433" Source="\\Itseelm-nt0034\ampes1$\Desktop\RegressionPack0.4\Resources\FunctionLibrary\ActionNavigation.txt" SourceLine="-1" >
<Disp><![CDATA[XcelBanner]]></Disp>
</NodeArgs>
</Step>
<Step rID="T51">
<Obj plainTxt="False" ><![CDATA[XcelAction]]></Obj>
<Details plainTxt="False" ><![CDATA[Frame]]></Details>
<Time><![CDATA[6/28/2016 - 16:53:12]]></Time>
<TimeTick>1467125592</TimeTick>
<Step rID="T52">
<Obj plainTxt="False" ><![CDATA[lnkCreateWorkflowGroup.Exist]]></Obj>
<Details plainTxt="False" ><![CDATA["Object exists"]]></Details>
<Time><![CDATA[6/28/2016 - 16:53:12]]></Time>
<TimeTick>1467125592</TimeTick>
<NodeArgs eType="Replay" icon="12" nRep="437" Source="\\Itseelm-nt0034\ampes1$\Desktop\RegressionPack0.4\Resources\FunctionLibrary\ActionNavigation.txt" SourceLine="-1" >
<Disp><![CDATA[lnkCreateWorkflowGroup.Exist]]></Disp>
</NodeArgs>
</Step>
<NodeArgs eType="Context" icon="11" nRep="436" Source="\\Itseelm-nt0034\ampes1$\Desktop\RegressionPack0.4\Resources\FunctionLibrary\ActionNavigation.txt" SourceLine="-1" >
<Disp><![CDATA[XcelAction]]></Disp>
</NodeArgs>
</Step>
<NodeArgs eType="Context" icon="7" nRep="432" Source="\\Itseelm-nt0034\ampes1$\Desktop\RegressionPack0.4\Resources\FunctionLibrary\ActionNavigation.txt" SourceLine="-1" >
<Disp><![CDATA[OWCS]]></Disp>
</NodeArgs>
</Step>
<NodeArgs eType="Context" icon="5" nRep="431" Source="\\Itseelm-nt0034\ampes1$\Desktop\RegressionPack0.4\Resources\FunctionLibrary\ActionNavigation.txt" SourceLine="-1" >
<Disp><![CDATA[OWCS]]></Disp>
</NodeArgs>
</Step>
<Step rID="T53">
<Obj ><![CDATA[CheckObject]]></Obj>
<Details ><![CDATA[Web Link  - CreateWorkflowGroupExist]]></Details>
<Time><![CDATA[6/28/2016 - 16:53:12]]></Time>
<TimeTick>1467125592</TimeTick>
<NodeArgs eType="User" icon="3" nRep="438" Source="\\Itseelm-nt0034\ampes1$\Desktop\RegressionPack0.4\Resources\FunctionLibrary\ActionNavigation.txt" SourceLine="-1" >
<Disp><![CDATA[CheckObject]]></Disp>
</NodeArgs>
</Step>
<Step rID="T54">
<Obj plainTxt="False" ><![CDATA[OWCS]]></Obj>
<Details plainTxt="False" ><![CDATA[Browser]]></Details>
<Time><![CDATA[6/28/2016 - 16:53:14]]></Time>
<TimeTick>1467125594</TimeTick>
<Step rID="T55">
<Obj plainTxt="False" ><![CDATA[OWCS]]></Obj>
<Details plainTxt="False" ><![CDATA[Page]]></Details>
<Time><![CDATA[6/28/2016 - 16:53:14]]></Time>
<TimeTick>1467125594</TimeTick>
<Step rID="T56">
<Obj plainTxt="False" ><![CDATA[XcelAction]]></Obj>
<Details plainTxt="False" ><![CDATA[Frame]]></Details>
<Time><![CDATA[6/28/2016 - 16:53:14]]></Time>
<TimeTick>1467125594</TimeTick>
<Step rID="T57">
<Obj plainTxt="False" ><![CDATA[lnkCreateWorkflowGroup.Exist]]></Obj>
<Details plainTxt="False" ><![CDATA["Object exists"]]></Details>
<Time><![CDATA[6/28/2016 - 16:53:14]]></Time>
<TimeTick>1467125594</TimeTick>
<NodeArgs eType="Replay" icon="12" nRep="442" Source="\\Itseelm-nt0034\ampes1$\Desktop\RegressionPack0.4\Resources\FunctionLibrary\ActionNavigation.txt" SourceLine="-1" >
<Disp><![CDATA[lnkCreateWorkflowGroup.Exist]]></Disp>
</NodeArgs>
</Step>
<Step rID="T58">
<Obj plainTxt="False" ><![CDATA[lnkCreateWorkflowGroup.Click]]></Obj>
<Details plainTxt="False" ><![CDATA[]]></Details>
<Time><![CDATA[6/28/2016 - 16:53:14]]></Time>
<TimeTick>1467125594</TimeTick>
<NodeArgs eType="Replay" icon="12" nRep="444" Source="\\Itseelm-nt0034\ampes1$\Desktop\RegressionPack0.4\Resources\FunctionLibrary\ActionNavigation.txt" SourceLine="-1" >
<Disp><![CDATA[lnkCreateWorkflowGroup.Click]]></Disp>
</NodeArgs>
</Step>
<NodeArgs eType="Context" icon="11" nRep="441" Source="\\Itseelm-nt0034\ampes1$\Desktop\RegressionPack0.4\Resources\FunctionLibrary\ActionNavigation.txt" SourceLine="-1" >
<Disp><![CDATA[XcelAction]]></Disp>
</NodeArgs>
</Step>
<NodeArgs eType="Context" icon="7" nRep="440" Source="\\Itseelm-nt0034\ampes1$\Desktop\RegressionPack0.4\Resources\FunctionLibrary\ActionNavigation.txt" SourceLine="-1" >
<Disp><![CDATA[OWCS]]></Disp>
</NodeArgs>
</Step>
<NodeArgs eType="Context" icon="5" nRep="439" Source="\\Itseelm-nt0034\ampes1$\Desktop\RegressionPack0.4\Resources\FunctionLibrary\ActionNavigation.txt" SourceLine="-1" >
<Disp><![CDATA[OWCS]]></Disp>
</NodeArgs>
</Step>
<Step rID="T59">
<Obj ><![CDATA[TakeAction]]></Obj>
<Details ><![CDATA[Web Link   - CreateWorkflowGroup
clicked - ]]></Details>
<Time><![CDATA[6/28/2016 - 16:53:14]]></Time>
<TimeTick>1467125594</TimeTick>
<NodeArgs eType="User" icon="3" nRep="445" Source="\\Itseelm-nt0034\ampes1$\Desktop\RegressionPack0.4\Resources\FunctionLibrary\ActionNavigation.txt" SourceLine="-1" >
<Disp><![CDATA[TakeAction]]></Disp>
</NodeArgs>
</Step>
<Step rID="T60">
<Obj ><![CDATA[TakeAction]]></Obj>
<Details ><![CDATA[Synchronize for - 3]]></Details>
<Time><![CDATA[6/28/2016 - 16:53:17]]></Time>
<TimeTick>1467125597</TimeTick>
<NodeArgs eType="User" icon="3" nRep="446" Source="\\Itseelm-nt0034\ampes1$\Desktop\RegressionPack0.4\Resources\FunctionLibrary\ActionNavigation.txt" SourceLine="-1" >